[
  {
    "id": "facilitators-in-training",
    "type": "people",
    "source_url": "https://www.nosetonose.info/facilitators%20in%20training.htm",
    "title": "Clown workshops with Nose to Nose",
    "region": "international",
    "language": "en",
    "body_html": "<h1><img align=\"right\" height=\"192\" src=\"https://www.nosetonose.info/images/group.jpg\" width=\"216\"/>FACILITATORS \n IN TRAINING 2012-14</h1>\n\n<p>Here are some places where people who are presently taking part \n in the two-year training live. This list is in the process of being \n created. <br/>\n For a description of the course - <a href=\"https://www.nosetonose.info/previouscourses/facilitator%20training%202012-14.htm\">click \n here</a></p>\n\n<h1>ISRAEL - Tel Aviv</h1>\n<em><strong>Lilach Danin Lavee </strong>- email <a href=\"mailto:lilach@nosetonose.info\">lilach@nosetonose.info</a></em><br/><em>Tel Aviv</em>\n<h1></h1>\n\n<h1>GERMANY - Munich – Berlin – Hannover</h1>\n<em><strong>Angela Hopkins </strong>- email <a href=\"mailto:berlin@nosetonose.info\">berlin@nosetonose.info</a><br/>\n Potsdam</em>\n<p><em><strong>Hanna Mosch - </strong>email <a href=\"mailto:dublin@nosetonose.info\">hanna@nosetonose.info</a><br/>\n Munich</em></p>\n\n<h1>IRELAND - Dublin</h1>\n<em><strong>Susan Coughlan </strong>- email <a href=\"mailto:dublin@nosetonose.info\">dublin@nosetonose.info</a></em><br/><em>Dublin</em>\n<p><em><strong>Piotr Bujak </strong>- email <a href=\"mailto:piotr@nosetonose.info\">piotr@nosetonose.info</a></em></p>\n\n<h1>UK - London – Nottingham - Hastings - Bexhill-on-sea</h1>\n<em><strong>David Wheeler </strong>- email <a href=\"mailto:wheeler@nosetonose.info\">wheeler@nosetonose.info</a><br/>\n GP trainer and Programme Director for Greenwich GP Training Scheme \n - London</em>\n<p><em><strong>Allie Bowler </strong>- email <a href=\"mailto:allie@nosetonose.info\">allie@nosetonose.info</a><br/>\n Bexhill-on-sea</em></p>\n\n<h1>FRANCE - Paris </h1>\n\n<h1>TAIWAN - Taipei</h1>\n\n<h1></h1>\n\n<p></p>\n<span class=\"contenttd\">\n<div class=\"footer\">\n<p>© 2024 - Nose to Nose - Clown workshops.</p>\n\n<div id=\"dot0\" style=\"WIDTH: 20px; POSITION: absolute; HEIGHT: 15px; visibility: hidden; left: -20px; top: -20px;\" valign=\"bottom\"><dd><a href=\"https://www.nosetonose.info/facilitators%20in%20training.htm\"><img border=\"0\" height=\"18\" src=\"https://www.nosetonose.info/images/nez.gif\" width=\"18\"/></a></dd></div>\n\n<div id=\"dot1\" style=\"WIDTH: 26px; POSITION: absolute; HEIGHT: 15px; left: -20px; top: -20px;\"><dd><a href=\"https://www.nosetonose.info/facilitators%20in%20training.htm\"><img border=\"0\" height=\"18\" src=\"https://www.nosetonose.info/images/nez.gif\" width=\"18\"/></a></dd></div>\n\n<div id=\"dot2\" style=\"WIDTH: 25px; POSITION: absolute; HEIGHT: 15px; left: -20px; top: -20px;\"><dd><a href=\"https://www.nosetonose.info/facilitators%20in%20training.htm\"><img border=\"0\" height=\"18\" src=\"https://www.nosetonose.info/images/nez.gif\" width=\"18\"/></a></dd></div>\n\n<div id=\"dot3\" style=\"WIDTH: 24px; POSITION: absolute; HEIGHT: 15px; left: -20px; top: -20px;\"><dd><a href=\"https://www.nosetonose.info/facilitators%20in%20training.htm\"><img border=\"0\" height=\"18\" src=\"https://www.nosetonose.info/images/nez.gif\" width=\"18\"/></a></dd></div>\n\n<div id=\"dot4\" style=\"WIDTH: 26px; POSITION: absolute; HEIGHT: 15px; left: -20px; top: -20px;\"><dd><a href=\"https://www.nosetonose.info/facilitators%20in%20training.htm\"><img border=\"0\" height=\"18\" src=\"https://www.nosetonose.info/images/nez.gif\" width=\"18\"/></a></dd></div>\n\n<div id=\"dot5\" style=\"WIDTH: 24px; POSITION: absolute; HEIGHT: 15px; left: -20px; top: -20px;\"><dd><a href=\"https://www.nosetonose.info/facilitators%20in%20training.htm\"><img border=\"0\" height=\"18\" src=\"https://www.nosetonose.info/images/nez.gif\" width=\"18\"/></a></dd></div>\n\n<div id=\"dot6\" style=\"WIDTH: 25px; POSITION: absolute; HEIGHT: 8px; left: -20px; top: -20px;\"><dd><a href=\"https://www.nosetonose.info/facilitators%20in%20training.htm\"><img border=\"0\" height=\"18\" src=\"https://www.nosetonose.info/images/nez.gif\" width=\"18\"/></a></dd></div>\n<span class=\"contenttd\"></span></div>\n</span>",
    "body_markdown": "# FACILITATORS IN TRAINING 2012-14\n\nHere are some places where people who are presently taking part\nin the two-year training live. This list is in the process of being\ncreated.   \nFor a description of the course - [click\nhere](https://www.nosetonose.info/previouscourses/facilitator%20training%202012-14.htm)\n\n# ISRAEL - Tel Aviv\n\n***Lilach Danin Lavee** - email [lilach@nosetonose.info](mailto:lilach@nosetonose.info)*  \n*Tel Aviv*\n\n# \n\n# GERMANY - Munich – Berlin – Hannover\n\n***Angela Hopkins** - email [berlin@nosetonose.info](mailto:berlin@nosetonose.info)  \nPotsdam*\n\n***Hanna Mosch -** email [hanna@nosetonose.info](mailto:dublin@nosetonose.info)  \nMunich*\n\n# IRELAND - Dublin\n\n***Susan Coughlan** - email [dublin@nosetonose.info](mailto:dublin@nosetonose.info)*  \n*Dublin*\n\n***Piotr Bujak** - email [piotr@nosetonose.info](mailto:piotr@nosetonose.info)*\n\n# UK - London – Nottingham - Hastings - Bexhill-on-sea\n\n***David Wheeler** - email [wheeler@nosetonose.info](mailto:wheeler@nosetonose.info)  \nGP trainer and Programme Director for Greenwich GP Training Scheme\n- London*\n\n***Allie Bowler** - email [allie@nosetonose.info](mailto:allie@nosetonose.info)  \nBexhill-on-sea*\n\n# FRANCE - Paris\n\n# TAIWAN - Taipei\n\n# \n\n© 2024 - Nose to Nose - Clown workshops.\n\n:   [![](https://www.nosetonose.info/images/nez.gif)](https://www.nosetonose.info/facilitators%20in%20training.htm)\n\n:   [![](https://www.nosetonose.info/images/nez.gif)](https://www.nosetonose.info/facilitators%20in%20training.htm)\n\n:   [![](https://www.nosetonose.info/images/nez.gif)](https://www.nosetonose.info/facilitators%20in%20training.htm)\n\n:   [![](https://www.nosetonose.info/images/nez.gif)](https://www.nosetonose.info/facilitators%20in%20training.htm)\n\n:   [![](https://www.nosetonose.info/images/nez.gif)](https://www.nosetonose.info/facilitators%20in%20training.htm)\n\n:   [![](https://www.nosetonose.info/images/nez.gif)](https://www.nosetonose.info/facilitators%20in%20training.htm)\n\n:   [![](https://www.nosetonose.info/images/nez.gif)](https://www.nosetonose.info/facilitators%20in%20training.htm)",
    "images": [
      {
        "src": "https://www.nosetonose.info/images/group.jpg",
        "alt": ""
      },
      {
        "src": "https://www.nosetonose.info/images/nez.gif",
        "alt": ""
      }
    ],
    "scraped_at": "2026-08-27T17:30:20.072377+00:00",
    "meta": {
      "encoding": "latin-1"
    }
  },
  {
    "id": "nax/team-na",
    "type": "people",
    "source_url": "https://www.nosetonose.info/nax/team%20na.htm",
    "title": "Clown workshops with Nose to Nose",
    "region": "na",
    "language": "en",